{"event": "message.created.v1", "version": 1, "room_id": "01J8ZC2V9Q4T5W6X7Y8Z9ABCDE", "occurred_at": "2026-08-24T12:00:00Z", "data": {"id": "01J8ZC2V9Q4T5W6X7Y8Z9ABCDG", "kind": "system", "author": {"id": "01J8ZC2V9Q4T5W6X7Y8Z9ABCDF", "name": "Alice"}, "body": "", "payload": {"event": "member.joined", "actor_id": "01J8ZC2V9Q4T5W6X7Y8Z9ABCDF"}, "reply_to_id": null, "created_at": "2026-08-24T12:00:00Z", "attachments": []}}
